{
  "contract_id": "champion",
  "schema_version": "3.0.0",
  "strategy_id": "fixture-reference",
  "strategy_version": "v1",
  "adapter_id": "fixture-reference-adapter/v1",
  "adapter_sha256": "a692698ca214c8354c927ad11998958f834edfdbafe3ac0b507f8587651aa86a",
  "promoted_at": "2026-07-29T07:59:00Z",
  "promotion_compatibility": {
    "dataset_family_id": "fixture-daily/v1",
    "data_schema_sha256": "f7c3a922e4ee8834bcea26870e689f99f90d2093c215ccd0baf72387567a5caf",
    "normalization_version": "fixture-normalizer/v1",
    "universe_policy_id": "fixture-csi800",
    "universe_policy_version": "v1"
  },
  "promotion_evidence": {
    "dataset_manifest_sha256": "45089ef552f26b21a2acc764feb9e5052331ac209bee61bb342b0b8fc03756b2",
    "dataset_snapshot_sha256": "c9165f08627da8fbe3735ada17d78d91a1b254adf52fde4a18fda30821330868",
    "universe_snapshot_sha256": "854733ffaa2378d46e404acc65d851f588262b2be3aae4bcdc55e18cb14b680a"
  },
  "fixed_contract_set": {
    "cost_model_sha256": "06fe9101e0e300f3da939d1180e975b6afa7da4a7803e4e124d7ad645dd8240e",
    "market_rules_sha256": "28672e83f2aded869b4b3d196602458eab364b8d6e656b602d00752f591388fa",
    "execution_policy_sha256": "e4fa6bc36b3eeb665421f1fbad061e48fb5d03bee020280aa9d59b27e38b0a32",
    "portfolio_risk_sha256": "26b08e059e67a60202783186d107c8e72339028c744c8697c2d1efbc5925451e",
    "code_sha256": "cdf65f936f12efeea555f9a5f84fde5bb7c7770b9d500a1571de8e38ebaab47c",
    "config_sha256": "43ffada4771a7a1c99f819f6b62c6d22d6f72824a666b64a373cb312388a7597",
    "lockfile_sha256": "9df6035631bc007d5313d3ade759d58bb81d2a6eec2df99bb9b02c176d484797"
  },
  "promotion_report_sha256": "dddddddddddddddddddddddddddddddddddddddddddddddddddddddddddddddd"
}
